{
  "audit_id": "lifecycle-source-laboratory-plan-v1",
  "audit_projection_digest": "ed1b88a489e7e3391977718ae55dc12552b064dc7d622887109f4171602f3d45",
  "authority_effect": "none",
  "blockers": [],
  "canonical_semantic_digest": "d1a060ef8a08bfc6c50633f776ec6ff47ef4b30410992cf846666890d39938d5",
  "canonical_spell_id": "work-pack-readiness-audit",
  "configured_commands_executed": false,
  "evidence_ceiling": "frozen-input-contractual-readiness",
  "flags": [],
  "manifest": {
    "authority_bindings": {
      "canonical_authority_refs": [
        {
          "artifact_ref": {
            "path": "development/lifecycle-source-laboratory/PLAN-EVIDENCE.json",
            "sha256": "31a1663ac84bbd4438d5b308573943dd360be95bc5c28371d6f704c4fdf23914",
            "size_bytes": 1375
          },
          "binding_id": "canonical-objective",
          "owner_ref": "invoke",
          "selector": "/objective"
        }
      ],
      "derived_projection_refs": [
        {
          "audit_projection_digest": "ed1b88a489e7e3391977718ae55dc12552b064dc7d622887109f4171602f3d45",
          "authority_effect": "none",
          "producer": "work-pack-readiness-audit"
        }
      ],
      "execution_byte_baselines": [
        {
          "baselines": [],
          "unit_id": "SWU-LSL-001"
        },
        {
          "baselines": [],
          "unit_id": "SWU-LSL-002"
        },
        {
          "baselines": [],
          "unit_id": "SWU-LSL-003"
        }
      ],
      "semantic_bindings": {
        "closeout": {
          "artifact_ref": {
            "path": "development/lifecycle-source-laboratory/PLAN-EVIDENCE.json",
            "sha256": "31a1663ac84bbd4438d5b308573943dd360be95bc5c28371d6f704c4fdf23914",
            "size_bytes": 1375
          },
          "binding_id": "semantic-closeout",
          "owner_ref": "invoke",
          "selector": "/closeout"
        },
        "material": {
          "artifact_ref": {
            "path": "development/lifecycle-source-laboratory/PLAN-EVIDENCE.json",
            "sha256": "31a1663ac84bbd4438d5b308573943dd360be95bc5c28371d6f704c4fdf23914",
            "size_bytes": 1375
          },
          "binding_id": "semantic-material",
          "owner_ref": "invoke",
          "selector": "/material"
        },
        "owner": {
          "artifact_ref": {
            "path": "development/lifecycle-source-laboratory/PLAN-EVIDENCE.json",
            "sha256": "31a1663ac84bbd4438d5b308573943dd360be95bc5c28371d6f704c4fdf23914",
            "size_bytes": 1375
          },
          "binding_id": "semantic-owner",
          "owner_ref": "invoke",
          "selector": "/owner"
        },
        "receipt": {
          "artifact_ref": {
            "path": "development/lifecycle-source-laboratory/PLAN-EVIDENCE.json",
            "sha256": "31a1663ac84bbd4438d5b308573943dd360be95bc5c28371d6f704c4fdf23914",
            "size_bytes": 1375
          },
          "binding_id": "semantic-receipt",
          "owner_ref": "invoke",
          "selector": "/receipt"
        },
        "validation": {
          "artifact_ref": {
            "path": "development/lifecycle-source-laboratory/PLAN-EVIDENCE.json",
            "sha256": "31a1663ac84bbd4438d5b308573943dd360be95bc5c28371d6f704c4fdf23914",
            "size_bytes": 1375
          },
          "binding_id": "semantic-validation",
          "owner_ref": "invoke",
          "selector": "/validation"
        }
      }
    },
    "authority_effect": "none",
    "canonical_plan_graph": {
      "finite_frontier": [
        "SWU-LSL-001",
        "SWU-LSL-002",
        "SWU-LSL-003"
      ],
      "units": [
        {
          "canonical_successors": [
            "SWU-LSL-002"
          ],
          "dependencies": [],
          "unit_id": "SWU-LSL-001"
        },
        {
          "canonical_successors": [
            "SWU-LSL-003"
          ],
          "dependencies": [
            "SWU-LSL-001"
          ],
          "unit_id": "SWU-LSL-002"
        },
        {
          "canonical_successors": [
            "__complete__"
          ],
          "dependencies": [
            "SWU-LSL-002"
          ],
          "unit_id": "SWU-LSL-003"
        }
      ]
    },
    "classifier_version": "wpra-projection-v1",
    "closeout_bindings": [
      {
        "allowed_delta_policy_ref": {
          "artifact_ref": {
            "path": "development/lifecycle-source-laboratory/PLAN-EVIDENCE.json",
            "sha256": "31a1663ac84bbd4438d5b308573943dd360be95bc5c28371d6f704c4fdf23914",
            "size_bytes": 1375
          },
          "binding_id": "allowed-delta-0",
          "owner_ref": "invoke",
          "selector": "/closeout/delta"
        },
        "compensation": {
          "mode": "none",
          "rationale": "Create-only repository-local unit blocks before successor on failure."
        },
        "owner_receipt_contract_ref": {
          "artifact_ref": {
            "path": "development/lifecycle-source-laboratory/PLAN-EVIDENCE.json",
            "sha256": "31a1663ac84bbd4438d5b308573943dd360be95bc5c28371d6f704c4fdf23914",
            "size_bytes": 1375
          },
          "binding_id": "closeout-owner-0",
          "owner_ref": "invoke",
          "selector": "/closeout"
        },
        "unit_id": "SWU-LSL-001"
      },
      {
        "allowed_delta_policy_ref": {
          "artifact_ref": {
            "path": "development/lifecycle-source-laboratory/PLAN-EVIDENCE.json",
            "sha256": "31a1663ac84bbd4438d5b308573943dd360be95bc5c28371d6f704c4fdf23914",
            "size_bytes": 1375
          },
          "binding_id": "allowed-delta-1",
          "owner_ref": "invoke",
          "selector": "/closeout/delta"
        },
        "compensation": {
          "mode": "none",
          "rationale": "Create-only repository-local unit blocks before successor on failure."
        },
        "owner_receipt_contract_ref": {
          "artifact_ref": {
            "path": "development/lifecycle-source-laboratory/PLAN-EVIDENCE.json",
            "sha256": "31a1663ac84bbd4438d5b308573943dd360be95bc5c28371d6f704c4fdf23914",
            "size_bytes": 1375
          },
          "binding_id": "closeout-owner-1",
          "owner_ref": "invoke",
          "selector": "/closeout"
        },
        "unit_id": "SWU-LSL-002"
      },
      {
        "allowed_delta_policy_ref": {
          "artifact_ref": {
            "path": "development/lifecycle-source-laboratory/PLAN-EVIDENCE.json",
            "sha256": "31a1663ac84bbd4438d5b308573943dd360be95bc5c28371d6f704c4fdf23914",
            "size_bytes": 1375
          },
          "binding_id": "allowed-delta-2",
          "owner_ref": "invoke",
          "selector": "/closeout/delta"
        },
        "compensation": {
          "mode": "none",
          "rationale": "Create-only repository-local unit blocks before successor on failure."
        },
        "owner_receipt_contract_ref": {
          "artifact_ref": {
            "path": "development/lifecycle-source-laboratory/PLAN-EVIDENCE.json",
            "sha256": "31a1663ac84bbd4438d5b308573943dd360be95bc5c28371d6f704c4fdf23914",
            "size_bytes": 1375
          },
          "binding_id": "closeout-owner-2",
          "owner_ref": "invoke",
          "selector": "/closeout"
        },
        "unit_id": "SWU-LSL-003"
      }
    ],
    "closure_receipt_refs": [
      {
        "artifact_ref": {
          "path": "development/lifecycle-source-laboratory/PLAN-EVIDENCE.json",
          "sha256": "31a1663ac84bbd4438d5b308573943dd360be95bc5c28371d6f704c4fdf23914",
          "size_bytes": 1375
        },
        "binding_id": "define-exit",
        "owner_ref": "invoke",
        "selector": "/status"
      },
      {
        "artifact_ref": {
          "path": "development/lifecycle-source-laboratory/PLAN-EVIDENCE.json",
          "sha256": "31a1663ac84bbd4438d5b308573943dd360be95bc5c28371d6f704c4fdf23914",
          "size_bytes": 1375
        },
        "binding_id": "design-exit",
        "owner_ref": "invoke",
        "selector": "/status"
      }
    ],
    "continuity_projection": {
      "completed_unit_receipt_refs": [],
      "cursor": "SWU-LSL-001",
      "joined_closeout_receipt_refs": [],
      "projected_next_successor": {
        "authority_effect": "none",
        "canonical_successor_ref": {
          "artifact_ref": {
            "path": "development/lifecycle-source-laboratory/PLAN-EVIDENCE.json",
            "sha256": "31a1663ac84bbd4438d5b308573943dd360be95bc5c28371d6f704c4fdf23914",
            "size_bytes": 1375
          },
          "binding_id": "canonical-successor",
          "owner_ref": "invoke",
          "selector": "/successor"
        },
        "continuation_router_verification_receipt_ref": {
          "artifact_ref": {
            "path": "development/lifecycle-source-laboratory/PLAN-EVIDENCE.json",
            "sha256": "31a1663ac84bbd4438d5b308573943dd360be95bc5c28371d6f704c4fdf23914",
            "size_bytes": 1375
          },
          "binding_id": "continuation-verification",
          "owner_ref": "invoke",
          "selector": "/continuation"
        },
        "equivalence_validator_ref": {
          "artifact_ref": {
            "path": "development/lifecycle-source-laboratory/PLAN-EVIDENCE.json",
            "sha256": "31a1663ac84bbd4438d5b308573943dd360be95bc5c28371d6f704c4fdf23914",
            "size_bytes": 1375
          },
          "binding_id": "equivalence-validator",
          "owner_ref": "invoke",
          "selector": "/equivalence"
        },
        "projection_owner_ref": "work-pack-readiness-audit",
        "unit_id": "SWU-LSL-001"
      }
    },
    "epoch_binding": {
      "approval_status": "unapproved",
      "approved_frontier_ref": [
        "SWU-LSL-001",
        "SWU-LSL-002",
        "SWU-LSL-003"
      ],
      "audit_projection_digest": "ed1b88a489e7e3391977718ae55dc12552b064dc7d622887109f4171602f3d45",